<?xml version="1.0" encoding="UTF-8"?>
<Window size="300,200" sizebox="4,4,4,4" caption="0,0,0,24" mininfo="100,200" roundcorner="2,2,2,2" xsi:noNamespaceSchemaLocation="file:///C:/Users/Administrator/Desktop/dexter/Projects/DirectUI/Debug/dui.xsd" xmlns:xsi="http://www.w3.org/2001/XMLSchema-instance">
	<DockLayout lastfill="true">
		<ContentControl inset="4,4,4,0" height="24" name="tilebar" dockside="top">
			<HorizontalLayout childpadding="2">
				<Control width="16" height="16" padding="0,0,4,0" bkimage="eve_trade_ui - 0002.ico"/>
				<Label  width="110" >
					<TextBlock text="测试窗口-静态标签" textcolor="#ffffffff"/>
				</Label>
				<Control/>
				<Button name="mixbtn" width="32" height="16"/>
				<Button name="restorebtn" visible="false" width="32" height="16"/>
				<Button name="maxbtn" width="32" height="16"/>
				<Button name="closebtn" width="32" height="16"/>
			</HorizontalLayout>
		</ContentControl>
		<ContentControl inset="1,1,1,1" name="dialog" bordersize="1,1,1,1" bordercolor="#FF000000">
		<ScrollViewer vscrollbar="show">
			<VerticalLayout>
				<HtmlBlock  text="{c #ff0000ff}测试支持{/c}{c #ffffffff}html语法的{/c}{a}{c #ff00ff00 #ffffff00}minihtml渲染器{/c}{/a}" />
				<MenuButton text="测试菜单按钮" name="testMenu" width="80" horizontalalignment="left"/>
				<Progress height="20" value="40"/>
				<Edit text="测试文本框"/>
				<Option text="测试选项按钮"  group="true" />
				<Option text="测试选项按钮" group="true"/>
				<Button  text="测试按钮" />
				<Button text="测试按钮"  tabstop="true" />
				<Option text="测试复选按钮" tabstop="true"/>
				<Option text="测试复选按钮" tabstop="true"/>
				<Button  text="测试按钮" height="40"/>
				<Button  text="测试按钮" height="40"/>
				<Button  text="测试按钮" height="40"/>
			</VerticalLayout>
		</ScrollViewer>
</ContentControl>
</DockLayout>
</Window>


